"6","Blockbuster movie Avatar has retaken the highest-grossing film of all time. The sci-fi epic debuted in 2009 and held the global box office title for a decade until it was overtaken by Marvel's Avengers: Endgame in 2019.","EXTQ",NULL,"22"
"7","Disney owns both films after the company bought entertainment assets from Fox in 2019. It also owns the Titanic movie, which is third on the list of highest-grossing movies.","EXTQ",NULL,"22"
"8","Chinese movie theatres have been open for several months now since pandemic-led shutdowns, and local movies have also been enjoying some of their strongest box-office sales ever.","EXTQ",NULL,"22"
"9","Bolivian Energy Minister Rafael Alarcon said Friday that Chinese company Sinohydro has won a tender to build the Ivirizu hydroelectric dam.","PARM",NULL,"18"
"10","The Ivirizu project will be developed over four years, with an investment of over 550 million U.S. dollars to bring 279.9 megawatts to the national grid once completed. The complex will have two hydroelectric power plants -- Sehuencas, which will produce 188.62MW, and Pelton, which will generate 64MW.","PARM",NULL,"18"
"11","A total of five working groups will build the dam itself as well as tunnels, while installing hydromechanical equipment and setting up transmission lines, Alarcon said in the city of Cochabamba.","EXTQ",NULL,"18"
"12","The construction has been given a budget of 190 million dollars, he added.","EXTQ",NULL,"18"
"13","China’s government has asked Alibaba Group Holding Ltd to dispose of its media assets

officials were shocked at how expansive Alibaba’s media interests have become","PARM",NULL,"26"
"14","The company, whose mainstay business is online retail, has stakes in the Twitter-like Weibo platform and several news outlets including the South China Morning Post

Such influence is seen as posing serious challenges to the Chinese Communist Party and its own powerful propaganda apparatus","PARM",NULL,"26"
"15","Mexico on Monday auctioned eight out of ten deep water oil and gas blocks up for grabs in the Gulf of Mexico, and scored a joint venture for a major crude field in the most hotly-anticipated round of the country’s energy opening so far. China’s Offshore Oil Corporation took two of the eight blocks.","EXTQ",NULL,"6"
"16","Almost 1.2 billion of those were areas rich in most-valuable light and super light crude secured by China Offshore, a unit of the Chinese giant CNOOC, in the Perdido Fold Belt, where output on the U.S. side of the formation has been booming for years.","PARM",NULL,"6"
"17","The government of the People's Republic of China, in conjunction with the Export-Import Bank of China, has entered a financial arrangement with T&T to provide $210 million for the completion of infrastructural (remedial) works on the National Academy for the Performing Arts (NAPA) in Port-of-Spain.","PARM",NULL,"10"
"18","The revelation was made on Monday by Minister of Foreign Affairs Dr Surujrattan Rambachan at the signing of the framework agreement for the provision of a concessional loan, at the International Waterfront Centre on Wrightson Road, Port-of-Spain.The academy, which was officially unveiled less two years ago (November 9, 2009) by the former government and the Urban Development Corporation of Trinidad and Tobago Ltd (Udecott), had cost taxpayers close to $500 million.","EXTQ",NULL,"10"
"19","Assistant minister of the Ministry of Commerce in the People's Republic of China, Li Rongcan, said while he commended T&T on its formal opening of the Commonwealth Heads of Government Meeting (CHOGM) at NAPA, he noted that both the Port-of-Spain and San Fernando academies (the latter now under construction) could aid in fostering cultural cohesion between the two nations as they forged to strengthen diplomatic relations.","EXTQ",NULL,"10"
"20","Asked about his government's newly-found appreciation for NAPA, having cited it in his address as a ""world-class facility,"" Rambachan noted that the People's Partnership's earlier criticism of the centre was based primarily on its improper timing.","EXTQ",NULL,"10"
"23","China’s West Pacific Petrochemical Corp, or WEPEC, is set to export 900,000 barrels of gasoline to Mexico this month amid a swelling glut of the motor fuel at home, according to an industry source with direct knowledge of the matter.","PARM",NULL,"19"
"24","Mexico has become increasingly dependent on fuel imports, mainly from the United States, due to a fall in domestic output because of longstanding refinery problems, forcing state-run Pemex to import nearly 600,000 bpd of fuel last year.","PARM",NULL,"19"
"25","PetroChina did not immediately respond to a request for comment.","PARM",NULL,"19"
"26","China will continue to firmly support Ecuador in the battle against COVID-19, do its best to provide necessary assistance and explore cooperation in areas such as vaccine and drug research and production, Chinese President Xi Jinping said in a phone conversation with Ecuadorian President Lenin Moreno on Tuesday. Noting that the COVID-19 epidemic is spreading in Ecuador, Xi offered sincere sympathies on behalf of the Chinese government and people.","PARM",NULL,"33"
"27","For his part, Moreno said that the Chinese government and people provided valuable assistance and support to Ecuador in combating COVID-19, which greatly contributed to his country's response to the pandemic. Noting that China is Ecuador's important comprehensive strategic partner, Moreno said the bilateral cooperation is based on friendship and mutual benefits.He said that Ecuador hopes to learn from China's successful experience in fighting the disease and strengthen cooperation with China to help his country overcome difficulties, prevail over the epidemic, and revitalize its economic development. Moreno said he is willing to keep close contact with Xi and jointly promote the development of the Ecuador-China relationship.","PARM",NULL,"33"
"28","According to the website of the Ministry of Works, the Curepe Interchange project was initiated as a solution to alleviating traffic congestion along the Churchill Roosevelt Highway, with the elimination of traffic signals along the corridor and the upgrade of intersections.","PARM",NULL,"11"
"29","He reminded the public that in February 2019 the Prime Minister turned the sod for the start of construction of the interchange.

“We anticipate that we should have full use of the bridge by the end of February which is about a year into the construction This has been a major achievement. So far we are on track with the project. We anticipate having a full handover by the end of March. We are happy with the performance of the contractor,” he said.

He added that they have set an ambitious target that would allow users of the Churchill Roosevelt Highway to drive from Port-of-Spain to Sangre Grande with no traffic lights in three to four years.","EXTQ",NULL,"11"
"30","On Friday, the National Infrastructure Development Company (NIDCO) informed of the temporary closure in a section of the Churchill Roosevelt Highway (CRH) in the vicinity of the Curepe Interchange which commenced on Sunday at 6 am and scheduled to end today at 3 am, in time for the traffic expected with the re-opening of schools.","EXTQ",NULL,"11"
"31","China delivered two solar panel parks to Cuba on Thursday, as part of bilateral cooperation in renewable energies.In an event held in Yaguaramas town in the central province of Cienfuegos, Chinese Ambassador to Cuba Chen Xi handed the management of the two parks over to the Cuban Ministry of Energy and Mines.","PARM",NULL,"14"
"32","After 18 months of construction, the two parks, one in the western province of Pinar del Rio and the other in Yaguaramas, started operations in February.","PARM",NULL,"14"
"33","""These two parks have a total capacity of 9 megawatts (MW) and the one in Yaguaramas is the largest in Cuba with 19,440 solar panels installed,"" Chen said.""This is a sign of friendship and willingness by the Chinese government towards the Cuban people. The confidence, brotherhood and solidarity between our countries grow day by day,"" Chen said.","PARM",NULL,"14"
"34","Meanwhile, Cuba's Deputy Minister of Energy and Mines Ruben Cid stressed that these facilities are part of a solar panel project financed by the Ministry of Commerce of China with a total capacity of 21 MW. Cid said China has actively participated in the renewable energy program that seeks to generate 24 percent of electricity in Cuba by 2030.""To date we have worked intensely with Chinese companies and institutions to carry out two wind farms in the province of Las Tunas, 319 MW in generation through solar panel parks and several bioelectric plants next to sugar refineries,"" he said.He added that Cuba plans to build 25 bioelectric plants with a generation capacity of 755 MW as well as 14 wind farms to produce 656 MW by 2030.","PARM",NULL,"14"
"35","Also, the country expects to install a capacity of 700 MW in solar panel parks and build 74 small hydroelectric plants to generate 56 MW.","PARM",NULL,"14"
"36","Finance Minister Colm Imbert is set to probe why $239 million was allocated by the previous government towards the Couva Children's Hospital when the project was being fully funded by the Chinese government.","PARM",NULL,"8"
"37","The lender is the Export Import Bank of China on behalf of China. The loan matures in 20 years.","PARM",NULL,"8"
"38","According to a June 1, 2013, article on news.gov.tt, the estimated cost of construction of the children's hospital was $975 million. The article said funding for the institution was through a government-to-government arrangement with China.","PARM",NULL,"8"
"39","the PM 10 pollution in six central districts reached ""over 8,100 micrograms per cubic metre"" on Monday. The WHO considers levels between 0-54 as ""good"" and 55-154"" as ""moderate"" levels of PM 10.","PARM",NULL,"23"
"40","The Chinese capital of Beijing was covered in thick dust on Monday as it experienced what its weather bureau has called the worst sandstorm in a decade.","PARM",NULL,"23"
"41","China will strengthen anti-trust regulatory powers to push forward healthy, sustainable development of internet platforms

China will improve the making of laws and regulations over internet platform companies to “fill in the gaps and loopholes in rules” to step up regulatory framework design on data ownership","PARM",NULL,"27"
"71","In December 2017, Russia obtained the go-ahead from the United Nations’ Security Council to deliver arms to CAR.","PARM",NULL,"42"
"72","Earlier this year Russia donated hundreds of weapons and sent 175 trainers to CAR to bolster the government’s fight against militia groups. And last week it said it planned to send additional equipment and deploy more instructors, escalating its most significant military foray in Africa in decades.","PARM",NULL,"42"
"73","Central African armed groups signed a preliminary agreement at the end of August in Khartoum under the aegis of Russia and Sudan, while the African Union, supported by Paris, was overseeing post-crisis negotiations.","PARM",NULL,"42"
"74","Russian Prime Minister Dmitry Medvedev has recently approved a draft deal with Sudan to ease port visit regulations for both navies. The draft agreement includes security provisions for seamen who will be allowed to go ashore unarmed. Navy ships carrying weapons of mass destruction, nuclear fuel, biological weapons, radioactive substances, toxins or drugs will be banned from entering ports.","PARM",NULL,"50"
"75","A deal between Sudan and Russia on navy port visits could morph into permanent Russian military presence on the Red Sea coast, the head of Sudan’s parliamentary defense committee told Sputnik.","PARM",NULL,"50"
"76","French President Emmanuel Macron arrived Saturday in Chad, where he will meet with his counterpart Idriss Deby to discuss the crisis in the Central African Republic (CAR), amid widespread concerns about increasing Russian influence in the country. France is suspicious about such Russian activities in what it thinks of as its sphere of influence. “It fears that the Russians are going to replace them as the CAR’s main patron,” said Thierry Vircoulon, a researcher at the Africa Centre of the Paris-based IFRI think-tank.  “Paris also fears that the Russians are trying to advance their economic interests there, and that they’re trying to develop ties with rebel groups to get their hands on natural resources, at the expense of the security situation,” added Roland Marchal, a central Africa specialist at the CNRS think-tank in Paris.","PARM",NULL,"54"
"77","Moscow has been supplying arms to the CAR since December 2017. Around 175 Russians, including five soldiers employed by private contractors, were sent to the country to train two battalions. That’s while a Russian, Valerii Zakharov, was appointed as a national seciurity adviser to the president.","EXTQ",NULL,"54"
"78","Russia also started talks with former members of the Seleka – an alliance of rebel militias that seized power in 2013 – and unsuccessfully tried to hold talks between the CAR government and armed groups in July 2018.","EXTQ",NULL,"54"
"79","Russia has stepped up its presence in the CAR in the past few years. But its strategies there, which rely on the use of private contractors and mercenary groups, have been employed since the Yugoslav Wars in the 1990s and, later, in Ukraine and Syria.","PARM",NULL,"34"
"80","This summer, three journalists investigating Wagner’s operations in the CAR were ambushed and killed. Footage captured by the journalists suggests Wagner may have been assisting both the government and rebels.","EXTQ",NULL,"34"
"81","In the CAR, Moscow has gone a step further, cementing deals for political consultations, joint foreign operations and security details for the president, Faustin-Archange Touadéra. In the future, mineral mining might present opportunities to “entrepreneurs and their little private armies,” Avramov said, even if the sector is currently underdeveloped.","PARM",NULL,"34"
"82","In August, Russian Foreign Minister Sergey Lavrov discussed plans to build a logistics center at the Port of Assab, in southern Eritrea, during a meeting with a high-level Eritrean delegation, according to RIA, a Russian state-owned news agency.","EXTQ",NULL,"34"
"83","President Vladimir Putin on Monday approved the creation of a Russian naval facility in Sudan capable of mooring nuclear-powered surface vessels, clearing the way for Moscow’s first substantial military foothold in Africa since the Soviet fall.","PARM",NULL,"46"
"84","The new facility, earmarked to be built in the vicinity of Port Sudan, will be capable of accommodating up to 300 military and civilian personnel and improve Russia’s ability to operate in the Indian Ocean, expanding its influence in Africa.

Putin, in a decree published on Monday, said he had approved a Russian government proposal to set up a naval logistics hub in Sudan and ordered the defence ministry to sign an agreement to make it happen.","EXTQ",NULL,"46"
"85","It has also forecast that Russia will fortify its new African outpost with advanced surface-to-air missile systems, allowing it to create a no-fly zone for miles around","EXTQ",NULL,"46"
"86","A Russian firm has signed a memorandum of understanding with the Congolese authorities for the rehabilitation and extension of the dilapidated rail network of the DRC.","PARM",NULL,"38"
"87","On October 23, a memorandum of understanding on cooperation was signed within the framework of the Russia-Africa economic forum in Sochi between the first deputy to the CEO of the Russian Railway Company, Alexander Micharin, and the Minister of Transport and communications from the DRC Didier Mazengu Mukanzu","PARM",NULL,"38"
"88","the project is for ""an amount of 500 million dollars"".","PARM",NULL,"38"
"89","A Russian delegation will be in Kinshasa on November 10, 2019","EXTQ",NULL,"38"
"90","President Tshisekedi attended the first Russia-Africa summit in Sochi on Wednesday and Thursday alongside 42 other leaders and more than 3,000 participants","EXTQ",NULL,"38"
"91","According to Russian media, the government of the DRC as well as those of Niger and Guinea have concluded agreements with an agency founded by a Russian businessman linked to the Kremlin, Konstantin Malofeïev.

Mr. Malofeev, who is the subject of US and European sanctions, will advise the three countries on how to raise more than 2.5 billion dollars for the construction of an oil pipeline in Niger and the construction of railways and roads in Guinea and DRC","PARM",NULL,"38"
"92","Mr Malofeev's agency, the International Agency for Sovereign Development (IASD), was established this year and had a huge booth on the sidelines of the Russia-Africa summit","EXTQ",NULL,"38"
"93","Just three weeks after three Russian journalists were murdered while investigating the role of Russian mercenaries in the Central African Republic, Moscow and the turbulent African country signed an agreement on Tuesday to expand military cooperation. Details of the agreement were not announced but it seemed to relate to Russian military trainers, 175 of whom are already present in the Central African Republic and who were the focus of a daring investigation last month by the Russian journalists.","PARM",NULL,"62"
"94","Speaking on Tuesday at a state arms exhibition near Moscow, Russia’s defense minister, Sergei K. Shoigu, made no mention of the murdered journalists but was quoted by Russian news agencies as hailing military cooperation with the Central African Republic. He was quoted as saying that the new agreement would “strengthen ties in the defense sphere” between Russia and the central African nation","EXTQ",NULL,"62"
"95","Russia has said that only five of its instructors in the Central African Republic — some of them based in Sibut, near where the journalists were killed — are military personnel, with the rest civilians. The journalists were trying to determine whether these civilian instructors were in fact working for Wagner, a murky private military contractor founded by a former officer in Russian military intelligence and linked to an associate of President Vladimir V. Putin.","EXTQ",NULL,"62"
"96","Russia told the United Nations this week it plans to withdraw the 300 ""military instructors"" it sent to the Central African Republic at the end of 2020 for the presidential election, diplomats told AFP Friday. ""The Russians have informed the UN that they will withdraw the troops and helicopters"" which had been deployed to the Central African Republic during the election at the end of December, a diplomat said, on condition of anonymity.","PARM",NULL,"58"
"97","In addition to several hundred ""instructors,"" Moscow had also deployed three or four transport helicopters. After having denied sending ""regular forces"" to the CAR, as Bangui had asserted, Russia finally acknowledged last month the deployment of at least ""300 additional military instructors."" The objective was to ""help"" the CAR ""to strengthen its defensive capacities"" in the run-up to the elections, the Russian authorities explained at the time. According to many witnesses and aid workers, these ""instructors"" went to the front lines to fight the rebels.","PARM",NULL,"58"
"98","The announcement of the Russian military withdrawal was made before the attacks carried out Wednesday on the outskirts of Bangui, and questions remained at the UN as to whether Moscow will confirm the departure of the military in light of those latest events.","PARM",NULL,"58"
"99","At Bangui's request, the Security Council, which met behind closed doors Wednesday to discuss the situation in the country, has scheduled a new meeting on January 21 which will be public, diplomats said. The CAR authorities want to use the opportunity to demand a lifting of the arms embargo, even on a temporary basis, to better fight rebels who still control large swathes of the country, according to a letter to the UN obtained by AFP.","EXTQ",NULL,"58"
"100","Democratic Republic of Congo is in talks with Russian state-owned bank VTB VTBR.MM over potential investments worth as much as $1 billion, Congolese officials said, though VTB said there had been no discussions about bilateral lending.","PARM",NULL,"43"
"101","In March, Congo’s foreign minister Leonard She Okitundu met with his Russian counterpart Sergei Lavrov in Moscow, where he offered Lavrov “a box of rare minerals” as a birthday gift, according to the Congolese ministry’s Twitter feed.","PARM",NULL,"43"
"102","A peace deal has been reached between the Central African Republic government and 14 armed groups in their first-ever direct dialogue, potentially ending years of conflict in the country, the United Nations and African Union announced Saturday.","PARM",NULL,"55"
"103","After more than 40 people were killed in a rebel attack on a displaced persons camp in November, both the leader of the 13,000-strong UN peacekeeping mission and the country's prime minister both acknowledged shortcomings in the response. ""I knew that we did not have all the necessary means to protect our people,"" the prime minister said.","EXTQ",NULL,"55"
"104","Last month the chief of Central African Republic's soccer federation appeared at the ICC for the first time since he was arrested last year in France on charges of crimes against humanity and war crimes. Patrice-Edouard Ngaïssona is accused of leading the anti-Balaka for at least a year early in the fighting.","EXTQ",NULL,"55"
"105","In November 2018 another Central African Republic militia leader and lawmaker, Alfred Yekatom, made his first ICC appearance, accused of crimes including murder, torture and using child soldiers. He allegedly commanded some 3,000 fighters in a predominantly Christian militia in and around the capital early in the fighting. He was arrested last year after firing gunshots in parliament.","EXTQ",NULL,"55"
"106","When a crowd in Bambari, in the Central African Republic, accused Mahamat Nour Mamadou of belonging to a militia group tied to the country’s previous regime, the consequences were swift and harsh.

Soldiers whisked Mamadou away to a nearby town hall, where he was questioned, and then to a base, where he was tortured for five days.

Mamadou told the AFP news agency that soldiers choked him with a chain, slashed his back with a knife and sliced off one of his fingers. Evidence of the abuse he endured appeared in an internal United Nations report circulated last month. 

What makes Mamadou’s case unique is the group he says tortured him: Russian soldiers.","PARM",NULL,"35"
"107","In 2017, Russian President Vladimir Putin flew Sudanese President Omar al-Bashir to Sochi, in western Russia, to discuss strategic interests.

Al-Bashir said he needed protection, and he promised minerals in return.","PARM",NULL,"35"
"108","The Putin ally is accused of supporting former Sudanese President Omar al-Bashir and advising him to violently suppress protests. In return for this support, Sudan gave businesses linked to Prigozhin access to gold and the ores of precious metals.","EXTQ",NULL,"39"
"109","In Sudan, a business he controls called M-Invest is accused of spreading disinformation and advising Bashir on ways to quell protests that swept the nation in 2019.
“M-Invest is believed to have advised Omar al-Bashir on how to create a whole system of false propaganda to discredit the leaders of the popular pro-democracy protests,” “Then also, they advised him to stage public executions and kill a reasonable number of protesters so as to quell the protest against his regime,”As payment for this support, Bashir’s regime is accused by the Treasury Department of granting gold mining concessions to Meroe Gold, a subsidiary of M-Invest.","PARM",NULL,"39"
"110","Meroe Gold, a mining company listed in the sanctions, is still active in Sudan and has deep ties to Sudan’s security forces. Baldo believes that Sudan’s transitional government will be eager to cut ties with the entity.","EXTQ",NULL,"39"
"111","The document was signed by Sergei Kochetkov, Rossiya Segodnya First Deputy Editor-in-Chief, and Ernest Kabila Ilunga, Director General of RTNC.

The agreement provides for regular exchanges of news content in English and French, including radio programs, joint projects and events. The parties also agreed to develop bilateral cooperation in the information space to strengthen relations between the two states.","PARM",NULL,"47"
"112","RTNC is one of the largest television and radio companies in the Congo. Its television network covers 70% of the country, while radio broadcasting reaches nine of the 26 Congolese provinces.","PARM",NULL,"47"
"113","The Sputnik news agency and radio has entered into a cooperation agreement with the Congo’s national broadcaster, RTNC (Radio Television Nationale Congolaise). The signing ceremony took place in Moscow on Thursday as part of the Congolese delegation’s visit to Russia.","EXTQ",NULL,"47"
"114","Sputnik is part of the Rossiya Segodnya media group with its headquarters in Moscow.","EXTQ",NULL,"47"
"115","Mr. Matemulane runs a think tank called Afric, which describes itself on its website as “funded by donors with a common passion to foster Africa’s development,” without mentioning Russia. In an interview, though, Mr. Matemulane said the group was launched last year with support from a St. Petersburg businessman he declined to name. Afric received prominent billing at a summit for dozens of African leaders hosted by President Vladimir V. Putin of Russia at the Black Sea resort of Sochi last week, and announced it would partner with a Russian propaganda specialist who had previously focused on the United States.","PARM",NULL,"63"
