"395","Ambassador Yan, in response, noted that with the establishment of diplomatic relations on May 30, 1977, Barbados had adhered to a One-China relations policy and support had been mutual, with the two cooperating and collaborating in international affairs.","PARM",NULL,"118"
"396","The Hon Finance Minister, Prime Minister Roosevelt Skerrit says his Government has been working behind the scenes for years to actualise an international airport for Dominica.","EXTQ",NULL,"119"
"397","In his Independence Day address on the weekend, he announced that the long-awaited facility will be delivered next year.

“We have been working on this project and have hired a reputable American firm to advise on the best way and best place for sitting an international airport,” he explained, “They have advised us on an area between Woodfordhill and Wesley.”","EXTQ",NULL,"119"
"398","Air Antilles has increased flights from four to seven days a week from Guadeloupe, Martinique and Saint Maarten into Canefield Airport and Douglas Charles Airport, Hon Skerrit revealed.","EXTQ",NULL,"119"
"399","He also announced plans to build a new container port and cruise village.","EXTQ",NULL,"119"
"400","“This week, we visited the site and on November 8th, they will send a team to review what we have done so far and to look at the next steps. So, my dear friends, with the solid support if the People’s Republic of China, Dominica will have its international airport and work will begin in earnest in 2020, the year of our Lord.”","EXTQ",NULL,"119"
"429","A brand new health center was inaugurated last Saturday, September 29 for the benefit of the inhabitants of the EGTB village - named after the former forestry company '' General exploitation and transport of wood (EGTB) ''. It is about the patriotic work of the honorable Magloire Joscelin Makango, deputy of Mbaïki 5. The assistant of the Russian adviser in matters of safety of President Touadera gave, on this occasion, drugs and other medical kits to the said center. In the medical kits handed over to the EGTB health center, Mr. Kopot indicated without too much detail that they consist of malaria tests, malaria treatment drugs ... in short, everything a health center needs. .","PARM",NULL,"102"
"430","Russia has signed a bilateral agreement to send military “specialists” to the Republic of Congo to advise their counterparts and repair Soviet equipment in a move that further increases Moscow’s footprint on the continent. The Russian advisers will help the Republic of Congo’s military with the upkeep of armored vehicles, rocket artillery and helicopters","PARM",NULL,"108"
"431","Since Western nations sanctioned Russia for annexing Crimea in 2014, Moscow has signed at least 20 military cooperation deals in sub-Saharan Africa, including with Ethiopia, Nigeria and Zimbabwe","PARM",NULL,"108"
"432","In the middle of last year, an unmarked vehicle began to make regular appearances in front of the Grand Café in central Bangui.  The bread was to feed the private military contractors - that is to say mercenaries - installed at the Berengo Palace, the former residence of Jean Bédel Bokassa [at the head of the country from 1966 to 1979], to train more a thousand Central African soldiers.","PARM",NULL,"98"
"433","The Russian presence in the Central African Republic went unnoticed until the end of July 2018, when three Russian journalists were killed on the road to Sibut, about 180 kilometers from the capital. They were investigating the dubious activities of the Wagner Group - a private Russian security company believed to be funded and run by Yevgeny Prigojin, close to President Vladimir Putin. The Wagner group would manage the military base in Berengo.","PARM",NULL,"98"
"434","In Madagascar, Russian political strategists have reportedly funded several candidates for the presidential election at the end of 2018.","PARM",NULL,"98"
"435","In the Central African Republic, Russia is said to have provided the government with arms free of charge in exchange for cheap mining contracts.","EXTQ",NULL,"98"
"436","Central African Republic considers hosting Russian military base. Kremlin denies discussion at Russia-Africa summit but CAR president says countries’ defense ministries were reviewing idea.","PARM",NULL,"104"
"437","In an interview with Russian state media, President Faustin-Archange Touadéra said he had also asked Russia for new weapons shipments for CAR’s soldiers, who have fought a civil war against rebel forces in the country since 2012.","EXTQ",NULL,"104"
"438","Russia holds its first Russia-Africa summit, an estimated £55m effort to charm African leaders with the prospect of arms deals, and investments in mining, nuclear energy and other spheres, while promising no political strings attached.","EXTQ",NULL,"104"
"439","Leaked documents revealed by the Guardian in June showed that Russia has sought to bolster its presence in at least 13 countries in Africa through military deals, private business contracts, and by grooming a new generation of leaders. That mission to spread Russian influence was led by Yevgeny Prigozhin, a businessman close to Putin whose interests include a private military group that has deployed to Ukraine, Syria and CAR.","EXTQ",NULL,"104"
"440","Central Africa is rich in diamonds, gold, and uranium which are yet to be explored, and Russia, using its new influence, has already secured mining concessions which were initially given to China.","PARM",NULL,"96"
"441","It has also established its presence in the neighbouring Democratic Republic of Congo, another mineral rich country with huge deposits of gold and diamond. Recently, it sent a team of military specialists to the country to offer maintenance and repair services to military equipment.","PARM",NULL,"96"
"442","In Sudan, Wagner reportedly advised President Omar Al-Bashir to help him consolidate his power.","EXTQ",NULL,"98"
"443","In fact, in 1960 the U.S.S.R. established the Peoples’ Freedom University of Russia in Moscow specifically to educate young people from Congo and other developing nations in Africa, Asia and South America.","PARM",NULL,"106"
"444","“We wish to develop relations (with Congo) in every direction,” Russian Foreign Minister Sergei Lavrov has asserted. Lavrov has declared that Moscow is willing to do whatever it can to help bring peace to the country and the rest of Africa. He hasn’t discussed the specifics of a Congo peace strategy, but Russia’s commitment is clear.","PARM",NULL,"106"
"445","Russia will send its military and weapons to the Central African Republic to help the country's authorities establish order. The President of the CAR Faustin Arrange Touadera personally asked Moscow about this. Within the framework of the agreements reached, Russia is taking measures aimed at studying the possibilities of mutually beneficial development of the natural resources of the CAR, the Russian Foreign Ministry said.","PARM",NULL,"94"
"446","With the consent of the UN Security Council Committee 2127, from the presence of the Russian Ministry of Defense , a batch of small arms and ammunition was delivered to the needs of the Central African army in late January - early February of this year. With the knowledge of the UN Security Council , five military and 170 Russian civilian instructors were also sent there to train the CAR military personnel, ”the diplomat said.","PARM",NULL,"94"
"447","He added that an important milestone in the development of bilateral cooperation was the meeting of Russian Foreign Minister Sergei Lavrov with the President of the Central African Republic, which took place on October 9, 2017 in Sochi , during which the mutual disposition to restore practical cooperation in the political, trade, economic and humanitarian fields was confirmed.","PARM",NULL,"94"
"448","In 2018, the implementation of exploration mining concessions began. We presume that the development of these projects will help stabilize the economic situation in the CAR, develop infrastructure, and will also serve as a basis for attracting additional investments in the country's economy, ”the diplomat said in detail.","EXTQ",NULL,"94"
"449","During his rule over the Central African Republic in the 1970s, Bokassa used a year's worth of development aid to stage an extravagant coronation, and he personally oversaw the torture of prisoners.
Now, four decades later, it is Russian soldiers who mill around this crumbling estate in Berengo—and the shifting power dynamic is raising concerns in the West. President Vladimir Putin is pushing into Africa, forging new partnerships and rekindling Cold War–era alliances.","EXTQ",NULL,"100"
"450","So the Kremlin is using ­diplomatic, economic and military tools to prospect for political influence and new markets in Africa—signing multibillion-dollar arms deals, bidding for big construction projects, boosting space communications, exploiting hydrocarbon reserves and launching publicized military interventions, alongside more clandestine operations.","PARM",NULL,"100"
"451","Touadéra and Russian Foreign Minister Sergey Lavrov met in the resort of Sochi last October. Then, despite a U.N. arms embargo on the war-wracked country, Moscow successfully lobbied for permission to donate weapons and ammunition to CAR's weak military.","EXTQ",NULL,"100"
"452","This arsenal reportedly amounted to thousands of assault rifles, handguns, rocket launchers, machine guns and anti-aircraft guns. Accompanying this haul, according to the Russian Foreign Ministry, were 175 instructors to train CAR's armed forces at a makeshift academy installed at the Berengo palace, outside Bangui.","EXTQ",NULL,"100"
"453","Touadéra is thought to have Russians in his presidential guard, as well as a Russian security adviser who enjoys close access to Bangui government policymakers.","EXTQ",NULL,"100"
"454","Russia and the CAR signed a military deal in August 2018, paving the way for Moscow to step up training of CAR’s armed forces.","PARM",NULL,"109"
"455","Russia delivered light arms to the CAR’s security forces earlier that year and said it had deployed 175 military and civilian instructors to train them. Russia obtained the go-ahead from the UN Security Council to deliver arms to CAR in December 2017, when a mostly Muslim rebel coalition overthrew its then-president and prompted reprisals from Christian militias. Russia sent plane loads of weapons and dozens of contractors last year to train CAR soldiers and secure mining projects, marking the start of its highest-profile military foray in sub-Saharan Africa for decades.","PARM",NULL,"109"
"456","Russia will deploy military specialists to the Republic of Congo to provide maintenance for military equipment that Moscow had previously given the African country, the Kremlin said Friday as the country's role in Africa came under the spotlight. ""These specialists will go there to help maintain military equipment provided to the Republic of the Congo earlier,"" Kremlin spokesman Dmitiry Peskov said Friday, adding that helicopters and armored vehicles would be among the equipment serviced by these specialists.  Peskov did not specify exactly how many Russian military personnel would be sent to the African country or whether they are regular service members of the Russian military or contractors.","PARM",NULL,"107"
"457","Congo shares a border with the Central African Republic, where three Russian journalists were recently murdered while investigating the activities of Russian mercenaries there. The journalists were investigating the Wagner Group, a mercenary army run by Yevgheniy Prigozhin, a close ally of Russian President Vladimir Putin who was also indicted as part of the two-year special counsel investigation into Russian interference in the 2016 U.S. presidential elections.","PARM",NULL,"107"
"458","As if that were not enough, the Russian partners of the Head of State installed at the heart of the Presidency of the Republic in Bangui, under the supervision of Mr. Harouna Douenba, another Ivorian adviser to the Head of State, a cell of restricted propaganda responsible for writing press articles and defining a comprehensive anti-Western and anti-Minusca campaign strategy in the country.

This Presidency cell, which supplies certain media with preformed articles (to the glory of Moscow and against Western interests in the CAR), and paid for once the publication is made, sponsors and remotely pilot not only anti-Western public demonstrations in Bangui, but also other websites and fictitious NGOs such as ANA (magnet Notre Afrique), directed by an Editorial Director of an online Central African newspaper, the association APPAP - (Alliance of political parties and personalities) coordinated by the Central African Cyriaque Azouassa, the anti-Minusca and Western campaign activist on social networks.

In addition to the media and NGOs sponsored by the Russians with Central African public funds, the cell of the Presidency of the Republic, which defines the overall strategy of anti-Minusca and Western propaganda, places particular emphasis on the creation of fake accounts. on social networks in an attempt to discredit certain online media by comments such as “Intox, fackNews, false information, without verifying it, let alone reading the article in question…. "". Comments that are sometimes close to idiocy are very easily recognized on social networks by readers.","PARM",NULL,"103"
"459","We learn, from well-informed sources, that the Russians are everywhere boasting of having started the construction of a meat-packing plant in Gbokolgbo, in the Ouaka prefecture. The factory is expected to create thirty (30) jobs in the local population in order to produce quality meat production, in compliance with modern sanitary quality vacuum packaging standards.","PARM",NULL,"101"
"460","The management of the factory would be entrusted to the sinister Peulh mercenary Ali Darass, the head of the UPC. Less spectacular than the extraction of gold or diamonds, livestock nevertheless represent nearly 13% of the gross domestic product (GDP) of the Central African Republic according to official figures.","PARM",NULL,"101"
"461","Especially since, according to the announcements made, the Russians have chosen to place the security of the factory under the protection of local militiamen.","PARM",NULL,"101"
"462","During this time, the Russian representatives continue to advance their pawns for an increased control of the institutions of the Central African Republic, a generous country whose sovereignty seems today controlled on the banks of the Volga. And they keep announcing the delivery of new weapons like the arrival of Russian officers in MINUSCA, but they always find a good explanation to explain their delay.","EXTQ",NULL,"101"
"463","The weather is rather cool at the beginning of October 2017, but the six Central Africans – including the President of the Central African Republic (CAR) – in the seaside resort of Sochi do not care.

They are interested only in their meeting with Sergei Lavrov, the Russian Foreign Minister.","PARM",NULL,"99"
"464","in March 2013, when the Seléka rebels took control of Bangui and ousted former President François Bozizé, Ngrébada, then a member of the presidential cabinet, sought refuge at the Russian Embassy.

Ngrébada spent several days with the then Ambassador Sergei Lobanov, for which, obviously, he was grateful. In September 2017, he organized two successive meetings between Touadéra and Russian investors. The first was in a luxurious hotel in Paris favoured by the president; the second was in Switzerland.","EXTQ",NULL,"99"
"465","In the UN Security Council, Russia had agreed to lift its veto on the delivery of French weapons to the Bangui regime and even proposed to plead for a temporary lifting of the arms embargo. But this diplomatic support is obviously not without conditions.

Included in the agreement, the terms of which were not made public at the time, was the creation of a Russian mining company in the Central African Republic, the Russian operation of an airfield in the Ouadda region, and the training by the Russians of the Central African National Guard and Army.","EXTQ",NULL,"99"
"466","From 26 January 2018, Russian planes started landing in Bangui, delivering weapons","PARM",NULL,"99"
"467","In June and July [2018], Léopold Mboli Fatran, Minister of Mines, granted mining recognition permits in the Yawa and Pama regions to Lobaye Invest Sarlu, a Russian company. The objective was to identify possible gold and diamond deposits.","PARM",NULL,"99"
"468","Wagner, a private security company, provides more than a thousand instructors to the Central African Republic, ensures the security of various institutions, and plays a leading role in the training of the Presidential Guard and the army.","EXTQ",NULL,"99"
"469","Since April 2018, Russian “instructors” have been residing in Jean-Bedel Bokassa’s former property in Berengo, and set up a training camp.","PARM",NULL,"99"
"470","Wagner and Sewa Security Services — which already operate airfields in Ndelé, Birao and Ouadda — have rehabilitated the 2,000m runway built by Bokassa.","EXTQ",NULL,"99"
"471","The mission to increase Russian influence on the continent is being led by Yevgeny Prigozhin, a businessman based in St Petersburg who is a close ally of the Russian president, Vladimir Putin. One aim is to “strong-arm” the US and the former colonial powers the UK and France out of the region. Another is to see off “pro-western” uprisings, the documents say.","PARM",NULL,"95"
"472","On 24 May the Kremlin announced it was dispatching a team of army specialists to the neighbouring Democratic Republic of the Congo. According to Dmitry Peskov, Putin’s press spokesman, they will service Russian-made military equipment. So far Moscow has signed military cooperation deals with about 20 African states.","PARM",NULL,"95"
"473","Five days later the Kremlin said it would host the first ever Russia-Africa summit in October in the Black Sea resort of Sochi. Putin and Egypt’s president, Abdel Fatah al-Sisi, will chair the event. About 50 African leaders are due to attend. The aim is to foster political, economic and cultural cooperation.","PARM",NULL,"95"
"474","The Kremlin has recently stepped up its ground operation in Libya. Last November the Libyan commander Khalifa Haftar travelled to Moscow and met the defence minister, Sergei Shoigu. Prigozhin was spotted at the talks. Egypt is described as “traditionally supportive”.","EXTQ",NULL,"95"
"475","To restore security in the country, Central African President Touadéra asked for military assistance from Russia.","PARM",NULL,"97"
"476","Everything indicates that Russian experts are indeed there.  From March 31, President Touadéra presented with great pomp a first contingent of 200 men dressed in Russian camouflages and carrying Russian weapons. The unit was commanded by oddly white men.  At present, the White Guards have practically taken control of the presidential administration and enjoy unlimited access to his travel diary, key figures in Touadéra's entourage, his garage and armored vehicles.  The Central African presidential administration recognizes the existence of a “special Russian unit for strengthening the security of the president”.","EXTQ",NULL,"97"
"477","In October 2017, Central African President Faustin-Archange Touadéra traveled to Sochi, Russia to meet with Russian Foreign Minister Sergey Lavrov. From an official source, the purpose of the visit was to seek Russian support from the United Nations for a temporary lifting of the arms embargo on the Central African Republic.  A month later, the UN agreed, for Moscow's needs, to partially suspend the arms embargo in the Central African Republic","EXTQ",NULL,"97"
"478","President Touadéra also informally requested the supply of armaments and vehicles for three battalions of the Faca (Central African armed forces), or around 1,500 men. The response was positive.","PARM",NULL,"97"
"479","on January 26, 2018, a first Il-76 military cargo plane landed in the capital, Bangui.","PARM",NULL,"97"
"480","But the main surprise took place the day before, March 30, in the large football stadium in Bangui, during the celebration of the second anniversary of Touadéra's election. The President's bodyguard was made up of Slavic-type armed men. Until then, public security during major events was ensured in the capital by the last Rwandan soldiers from the UN mission in the Central African Republic (Minusca).","EXTQ",NULL,"97"
"481","A new post of “director of security” has been created within the administration, occupied by a Russian officer in charge of “supervising bodyguards”.","EXTQ",NULL,"97"
"482","Meanwhile, the mercenaries of the WAGNER Group and the Russian-Rwandan conglomerate continued to occupy the positions and towns voluntarily left by the CPC, perpetuating violence against the population and carrying out multiple extra-judicial executions in various places. of the country, as recently in the city of Bambari where the discovery of mass graves, kidnappings and summary executions are daily.","PARM",NULL,"132"
"483","Legislative in the Central African Republic: the feared violence did not take place
Bangui (Central African Republic) - Failing to mobilize massively, the Central Africans were able to vote in peace and security on Sunday for the second round of legislative elections. The results will be known by March 22.","PARM",NULL,"134"
"484","The disrupted ballot at the end of December paradoxically allowed the government to strengthen itself, by regaining ground militarily since. But the rebels were repulsed only thanks to the engagement in the fighting of hundreds of Russian paramilitaries and Rwandan soldiers, sent by Moscow and Kigali to the rescue of Faustin-Archange Touadéra and of a poorly trained and ill-equipped Central African army. It is not known how long they will stay in the country.","EXTQ",NULL,"134"
"485","After a few days of panic due to rumors of the advance of government forces, the rebels of the Unit for Peace in the Central African Republic (UPC), members of the coalition of patriots for change demanded traders from Mobaye, the capital of the Basse-Kotto prefecture to pay them a departure bonus before they leave the city.","PARM",NULL,"130"
"486","The rebels of the Patriots for Change (CPC) coalition demand money from the Mobaye traders before they withdraw from the city. According to local sources, they have asked for up to 1.5 million CFA francs.
After the takeover of the sub-prefecture of Alindao from rebel hands last week by mercenaries from the Russian company Wagner, the CPC rebels who are in Mobaye started to leave the city out of fear, leaving behind some of the their officer. The latter, who now wants to leave the city in turn, demands a departure bonus from traders amounting to 1.5 million CFA francs.","PARM",NULL,"130"
"487","On March 15, 2021, on social networks, more particularly on Facebook, the Minister Special Advisor to the Head of State, Mr. Fidèle Gouandjika, in a Live, indicated that the Central Africans could offer their wives as a sexual gift to the mercenaries of the Russian company Wagner for their intervention alongside the FACA soldiers in their fight against the rebels of the coalition of patriots for change (CPC).","PARM",NULL,"128"
"488","During a press briefing held in Bangui, in the capital, the women leaders, who lodged a complaint against Minister Counselor Gouandjika, demanded that justice be done, and that the person also be relieved of his functions.","PARM",NULL,"128"
"489","In 2018, when the Wagner company discreetly arrived in the Central African Republic, many inhabitants expressed their astonishment and their concern with regard to these foreigners who did not speak their language. It was even more surprising to note the insistence of these mercenaries to set up their bases in the provinces, in areas rich in natural resources","PARM",NULL,"124"
"490","To ensure that he can access resources undisturbed, Wagner then chooses to collaborate with local warlords. In 2019, in Khartoum, Sudan, a peace agreement was negotiated between the Central African government and more than a dozen armed groups. Among them, we find the group of General Nourreddine Adam… the FPRC, very active in the region of Bria. As if by chance, this is an affair which suits Wagner's interests well.

The Khartoum agreement, intended to work for peace in the Central African Republic, has unfortunately been perverted by obscure private interests. It was later revealed that several armed groups signatories to the agreement had received large sums of money in exchange for their signature. Thus, this agreement, which is nevertheless an initiative necessary for the good of the country, is marred by corrupt maneuvers to facilitate access to the country's natural resources to unscrupulous individuals.","PARM",NULL,"124"
